raw_product,product_normalized
Bank account or service,Checking or savings account
Consumer Loan,"Payday loan, title loan, or personal loan"
Credit card,Credit card or prepaid card
Credit reporting,"Credit reporting, credit repair services, or other personal consumer reports"
Money transfers,"Money transfer, virtual currency, or money service"
Payday loan,"Payday loan, title loan, or personal loan"
Prepaid card,Credit card or prepaid card
Virtual currency,"Money transfer, virtual currency, or money service"
